flags,instruction,category,intent,response
BLZ,I can't talk with  a human agent,CONTACT,contact_human_agent,Thank you for reaching out! I'm sorry to hear that you're facing difficulties in connecting with a human agent. Please rest assured that I'm here to assist you and resolve this issue. Could you please provide me with some more details about the problem you're experiencing? This will help me find the best solution for you.
BLMZ,I have got to locate hte bills from {{Person Name}},INVOICE,check_invoice,"I'll get right on it! I understand your need to locate the bills associated with {{Person Name}}. To assist you in finding the relevant invoices, could you please provide me with some additional details such as the date range or any other specific information that might help narrow down the search? Rest assured, I'm here to guide you every step of the way and ensure a seamless experience."
BCELM,"I cannot pay, help me to inform of a problem with payments",PAYMENT,payment_issue,"I apologize for the inconvenience caused by the payment issue you're experiencing. I understand how frustrating it can be when you encounter difficulties while trying to make a payment. Rest assured, I'm here to assist you in resolving this problem. To help us further investigate and address the issue, could you please provide more details about the problem you are encountering? Any specific error messages or steps leading up to the issue would be helpful. Your input is valuable, and we're committed to finding a solution together. Thank you for bringing this to our attention, and we'll work diligently to get it sorted."
BL,I want help speaking to customer service,CONTACT,contact_customer_service,"Grateful for your contact! I get the sense that you're looking for assistance in speaking to our customer service team. I'm here to guide you through the process and ensure that you have a seamless experience. To connect with our customer service, you can reach them during {{Customer Support Hours}}. If you have any other questions, concerns, or experiences you'd like to share, please feel free to let me know. I'm here to help!"
BLZ,I try to see th accepted payment options,PAYMENT,check_payment_methods,"Thank you for reaching out! I completely understand that you tried to access the accepted payment options on our platform. I apologize for any inconvenience caused. Allow me to assist you in viewing our available payment methods.

To check the accepted payment options, you can visit our website's ""Payment"" or ""Checkout"" page. There, you will find a comprehensive list of the various payment methods we accept. If you encounter any difficulties or have further questions, please don't hesitate to let me know.

Your satisfaction is our priority, and I'm here to ensure a seamless payment experience for you."
BILQZ,where to sign up to the company nmewsletter,SUBSCRIPTION,newsletter_subscription,"Thank you for your interest in signing up for our company newsletter! To subscribe, you can visit our website at {{Website URL}} and navigate to the newsletter section. There you will find a sign-up form where you can enter your email address and other required information. Once you submit the form, you will be successfully subscribed to our newsletter and receive regular updates directly in your inbox. If you require any further assistance or have any questions, please don't hesitate to let me know."
BCILPQZ,I'd like to see the withdrwaal fee how can i do it,CANCEL,check_cancellation_fee,"I'll do my best! To view the withdrawal fee, you can log in to your account and navigate to the ""Fee Schedule"" or ""Account Charges"" section. This will provide you with the details of the withdrawal fee and any associated charges."
BL,I want to speak with someone,CONTACT,contact_human_agent,"I see what you mean! I'm on the same page that you would like to speak with someone. Your request is important, and I'm here to help. Let me quickly connect you with a human representative who will be able to assist you further. Kindly stay on the line while I transfer you."
BIL,can you help me getting bill #85632?,INVOICE,get_invoice,"I'll take care of it! I completely understand your request to access the bill with the number #{{Invoice Number}}. Please allow me a moment to retrieve the bill for you. In the meantime, if you have any other questions or concerns, feel free to let me know. I'm here to assist you!"
B,I don't know how to take a quick look at invoice #12588,INVOICE,check_invoice,"I've realized you're unsure about how to quickly access the details of invoice #{{Invoice Number}}. Allow me to guide you through the process. To take a quick look at your invoice, you can log in to your account on our website and navigate to the ""Billing"" or ""Invoice"" section. There, you should be able to find a list of your invoices, including invoice #{{Invoice Number}}. Clicking on the invoice will provide you with a detailed view of the charges, due date, and any other relevant information. If you encounter any difficulties during this process, please don't hesitate to reach out to our customer support team, who will be happy to assist you further."
BL,I don't know how to delete my platinum account,ACCOUNT,delete_account,"Thank you for getting in touch to us regarding the deletion of your {{Account Category}} account. I completely understand that you may be uncertain about the process, and I'm here to guide you through it. To delete your {{Account Category}} account, you can follow these steps:

1. Log in to your account on our website.
If you don't remember your login details, you can use the ""Forgot Password"" option to recover your account access.

2. Once you are logged in, navigate to the account settings or profile section.

3. Look for the option to manage your account or subscriptions. It may be labeled as ""Delete Account,"" ""Cancel Subscription,"" or something similar.

4. Click on the delete/cancel option and follow any additional prompts or confirmation steps that are presented.

5. If you encounter any difficulties or have further questions during the process, please don't hesitate to reach out to our customer support team, who will be more than happy to assist you personally.

Please keep in mind that deleting your {{Account Category}} account will result in the loss of any associated benefits, access, or content. If you have any concerns or require more information about the consequences of deleting your account, our customer support team will be available to address them.

I'm confident that these steps will help you navigate through the deletion process smoothly. If you need any further assistance, feel free to ask. We are committed to making this experience as easy as possible for you, ensuring your satisfaction every step of the way."
B,help me check in what cases can I ask to be refunded,REFUND,check_refund_policy,"Assuredly! I'm here to assist you in understanding the different scenarios in which you can request a refund. Here are some common cases:

1. **Product/Service Defect:** If the item or service you received has a defect or doesn't meet the description provided, you are usually eligible for a refund.
2. **Cancellation within Grace Period:** If you change your mind and decide to cancel your purchase within a specified grace period, you can typically request a refund.
3. **Unauthorized Charges:** If you notice any charges on your account that you didn't authorize or recognize, we will investigate and assist you in getting a refund if necessary.
4. **Event Cancellation:** If you purchased tickets for an event that gets canceled and no rescheduled date is announced, you are usually entitled to a refund.
5. **Duplicate Charges:** If you have been charged multiple times for the same item, please let us know so that we can rectify the situation and issue a refund if applicable.
6. **Non-delivery of Goods:** If you haven't received the product within the expected timeframe, we're here to help. You may qualify for a refund if the item doesn't arrive as promised.

It's important to note that refund policies may vary among vendors and service providers. I recommend reviewing the terms and conditions or contacting the specific seller for a complete understanding of their refund policy. If you have any specific order or concern, please provide me with the necessary details, such as {{Order Number}}, so that I can assist you further.

Is there anything else I can help you with?"""
BILQ,is it possible to locate my bill from {{Person Name}},INVOICE,check_invoice,"I pick up what you're putting down, your eagerness to locate your bill from {{Salutation}} {{Client Last Name}}. I'm here to assist you in this journey. Could you please provide me with any additional details or specific information about the bill that could help us find it quickly? Rest assured, I'm committed to helping you resolve this matter effectively."
BLQ,i want help to file a consumer claim against ur organization,FEEDBACK,complaint,"I'm sorry to hear that you are facing a situation where you need to file a consumer claim against our organization. I understand that this can be a frustrating experience, and I'm here to assist you throughout the process. To proceed with your claim, please provide me with the necessary details such as the nature of the issue, any relevant documentation, and your contact information. Our team will thoroughly review your claim and work towards a resolution. Rest assured that we take consumer concerns seriously, and we are committed to addressing your claim promptly and in a fair manner. Thank you for bringing this to our attention, and I'll do everything I can to support you in resolving this matter."
BILQ,uhave a free number to call customer support,CONTACT,contact_customer_service,I hear you! I'm following you that you are looking for a free number to call our customer support. We provide a toll-free number for you to contact our dedicated customer support team. You can reach us at {{Customer Support Phone Number}}. Our team is always ready to assist you. Is there anything else I can help you with?
BELMQ,i do not know how i can see the early termination penalties,CANCEL,check_cancellation_fee,"No problem! To view information about the early termination penalties, you can follow these steps:

1. Log into your account on our website.
2. Navigate to the ""Billing"" or ""Account"" section.
3. Look for the subsection labeled ""Termination Penalties"" or ""Cancellation Fees.""
4. Click on that subsection to view the details of the early termination penalties.

If you are still unable to find the information or have any further questions, please don't hesitate to reach out to our customer support team for assistance."
BILPW,could you help me to unsubscribe to the damn newsletter?,SUBSCRIPTION,newsletter_subscription,"I can relate to the understanding that you would like assistance with unsubscribing from our newsletter. I apologize for any inconvenience caused. To proceed with the cancellation, could you please provide me with your email address or any additional information that could help me identify your subscription? Rest assured that your request will be handled promptly and your privacy will be respected throughout the process."
BLM,I don't know how to inform of problems with a signup,ACCOUNT,registration_problems,"We understand that you may be unsure about how to inform us about the problems you're facing with the signup process. Don't worry, we're here to help guide you through the process. You can reach out to our customer support team through our website or app and provide them with the details of the signup issue you're experiencing. They will be able to assist you further and ensure that your feedback reaches the right team. Your input is invaluable to us, and we appreciate you taking the time to inform us of any problems you encounter during the signup process. Together, we can work towards resolving these issues and improving the overall signup experience for all our users."
BKL,download bill from {{Person Name}},INVOICE,get_invoice,"I acknowledge that you need assistance with downloading the bill from {{Salutation}} {{Client Full Name}}. Let me guide you through the process. First, please log in to your account and navigate to the ""Billing"" section. There, you should be able to access a list of your invoices. Look for the invoice from {{Salutation}} {{Client Full Name}} and click on the download button next to it. If you encounter any difficulties or have further questions, feel free to let me know. I'm here to help you with anything you need."
BLQ,want assistance receiving a refund of money,REFUND,get_refund,"I've understood you're seeking assistance in receiving a refund for your money, and I'm here to support you through this process. To help you with your refund request, could you please provide me with more details about your situation? Specifically, it would be helpful to know the product or service you purchased, the date of the transaction, and any relevant order or invoice numbers. With this information, I will be able to guide you on the next steps to initiate your refund successfully. Thank you for reaching out to us, and rest assured, we will do our best to resolve this matter swiftly and to your satisfaction."
